{
  "$schema": "http://json-schema.org/draft-07/schema#",
  "type": "object",
  "required": ["id", "name", "category", "fields"],
  "properties": {
    "id": { "type": "string", "pattern": "^[a-z-]+$" },
    "name": { "type": "string", "minLength": 2 },
    "description": { "type": "string" },
    "category": { "type": "string", "enum": ["game", "hardware", "movie", "series", "other"] },
    "default": { "type": "boolean", "default": false },
    "fields": {
      "type": "array",
      "minItems": 1,
      "items": {
        "type": "object",
        "required": ["id", "type", "label", "required"],
        "properties": {
          "id": { "type": "string", "pattern": "^[a-z_]+$" },
          "type": { "type": "string", "enum": ["textarea", "text", "select", "number", "rating"] },
          "label": { "type": "string" },
          "placeholder": { "type": "string" },
          "helpText": { "type": "string" },
          "required": { "type": "boolean" },
          "options": { "type": "array", "items": { "type": "string" } },
          "markdown": { "type": "boolean", "default": true },
          "order": { "type": "integer", "minimum": 0 }
        }
      }
    }
  }
}